repo,pr_url,pr_number,pr_title,pr_author,pr_created_at,pr_state,trigger_type,pr_score,catch_categories,summary,evaluated_at
onyx-dot-app/onyx,https://github.com/onyx-dot-app/onyx/pull/6849,6849,refactor: unify mimetype and file extensions,wenxi-onyx,2025-12-18 12:53:22,closed,new_pr,3/5,logic,"Greptile caught a missing dot prefix typo in the file extensions constants (`""json""` instead of `"".json""`), which would break JSON file validation since the extension comparison relies on consistent dot-prefixed format.",2025-12-18 14:16:26
nvidia/fuser,https://github.com/NVIDIA/Fuser/pull/5670,5670,Auto scheduler for TMA inner reduction,tbqh,2025-12-12 02:23:41,open,new_commits,3/5,logic,"Greptile identified a commented-out architecture check that would incorrectly enable TMA on unsupported GPU architectures, potentially causing crashes or incorrect behavior.",2025-12-18 14:16:39
opentech1/openchat,https://github.com/opentech1/openchat/pull/469,469,feat: migrate authentication from WorkOS to Better Auth with GitHub OAuth,leoisadev8,2025-12-18 12:42:26,closed,new_pr,2/5,"logic, security","Greptile identified three critical security and authentication bugs in this WorkOS to Better Auth migration: (1) sign-out fails silently due to deleting cookies with incorrect names, leaving users authenticated when they think they've logged out, (2) missing Secure flags on session cookies make them vulnerable to interception over HTTP, and (3) the migration logic enables account takeover by linking accounts based solely on email matching without proper verification.",2025-12-18 14:16:03
ever-co/ever-gauzy,https://github.com/ever-co/ever-gauzy/pull/9271,9271,Stage,evereq,2025-12-18 13:43:35,closed,new_pr,3/5,"data_integrity, logic","Greptile identified two medium-severity bugs: an authentication logic issue where users get stuck in an unauthenticated state with no recovery path when auth fails, and a data integrity bug where cached status progress values could leak between tenants, potentially causing tasks to be updated with incorrect status IDs from other organizations.",2025-12-18 14:16:03
stack-auth/stack-auth,https://github.com/stack-auth/stack-auth/pull/1073,1073,[Changelog] New changelog app,madster456,2025-12-18 13:06:42,closed,new_pr,2/5,runtime,Greptile caught a critical configuration incompatibility where the changelog app is set up for static export but includes an API route that will fail at runtime since Next.js static exports don't support API routes.,2025-12-18 14:16:53
browseros-ai/browseros-server,https://github.com/browseros-ai/BrowserOS-server/pull/105,105,"feat: rate limiter improvement (fetch daily limit, show error with google form link)",felarof99,2025-12-18 13:48:41,closed,new_pr,2/5,"runtime, data_integrity","Greptile identified a database migration bug where a column was removed from the schema definition without properly migrating existing SQLite databases. This would cause INSERT statement failures in production since existing tables still expect the old 4-column structure while the new code only provides 3 values, breaking existing installations.",2025-12-18 14:16:03
emerge-lab/pufferdrive,https://github.com/Emerge-Lab/PufferDrive/pull/192,192,collision fix,l1onh3art88,2025-12-18 14:00:11,closed,new_pr,1/5,logic,"Greptile caught a significant logic bug where squared distance is compared to a linear distance threshold, causing the max segment length constraint to be approximately 22x smaller than intended, which would break the collision detection fix.",2025-12-18 14:16:59
onyx-dot-app/onyx,https://github.com/onyx-dot-app/onyx/pull/6864,6864,feat: deep research continued,yuhongsun96,2025-12-18 15:49:49,closed,new_pr,1/5,logic,"Greptile caught two critical logic bugs: an infinite loop caused by incrementing the wrong counter variable (`llm_cycle_count` instead of `cycle_count`), and a data loss issue where collected documents are discarded by returning a hardcoded empty list instead of the gathered results. Both bugs would cause the research feature to malfunction completely.",2025-12-18 16:22:27
onyx-dot-app/onyx,https://github.com/onyx-dot-app/onyx/pull/6854,6854,feat: deep research more dev stuff,yuhongsun96,2025-12-18 14:07:47,closed,new_pr,2/5,runtime,Greptile caught a runtime bug where function calls weren't updated after the function signature was modified to require two new parameters (`is_reasoning_model` and `user_identity`). This mismatch between the function definition and its call sites would cause TypeError exceptions when the code executes.,2025-12-18 16:22:27
helicone/helicone,https://github.com/Helicone/helicone/pull/5436,5436,remove old models,chitalian,2025-12-18 14:56:56,closed,new_pr,2/5,logic,Greptile caught an incomplete refactoring where model definitions were removed from the codebase but references to those models still remained in other files. This would cause runtime failures when the application tries to look up the deleted model IDs.,2025-12-18 16:22:27
helicone/helicone,https://github.com/Helicone/helicone/pull/5434,5434,fix click jacking,chitalian,2025-12-18 14:03:56,closed,new_pr,2/5,runtime,Greptile correctly identified that importing DOMPurify directly (instead of isomorphic-dompurify) in Next.js components will cause runtime crashes during server-side rendering because DOMPurify requires the DOM/window object which doesn't exist on the server.,2025-12-18 16:23:08
nvidia/nvflare,https://github.com/NVIDIA/NVFlare/pull/3905,3905,[2.7] Redesign Cifar10 PT,holgerroth,2025-12-18 14:10:25,closed,new_pr,5/5,runtime,"Greptile caught a runtime error where `.cpu()` was called on a dictionary instead of a tensor, which would cause an AttributeError crash during federated learning client execution.",2025-12-22 16:22:33
onyx-dot-app/onyx,https://github.com/onyx-dot-app/onyx/pull/6869,6869,fix(tf): Instance Configurability,justin-tahara,2025-12-18 17:14:55,closed,new_pr,3/5,logic,"Greptile correctly identified a logic error where the final fallback in a ternary chain uses `v.instance_types` which will always be `null` at that point (since the condition already checked it was null). This would cause node groups other than 'main' or 'vespa' to have null instance types, likely causing Terraform errors or unexpected behavior.",2025-12-18 18:44:33
onyx-dot-app/onyx,https://github.com/onyx-dot-app/onyx/pull/6870,6870,feat: Deep Research works till the end,yuhongsun96,2025-12-18 17:17:51,closed,new_pr,1/5,logic,"Greptile identified a variable scoping bug where `tool_call` is a leftover loop variable from a previous iteration that gets reused in subsequent loops. This causes all ToolCallInfo objects and research results to be incorrectly associated with the last tool call instead of their actual originating calls, leading to silent data integrity issues where research results are attributed to the wrong tools.",2025-12-18 18:44:33
onyx-dot-app/onyx,https://github.com/onyx-dot-app/onyx/pull/6867,6867,feat(new vector db interface): Plug in delete for Vespa,acaprau,2025-12-18 16:20:40,closed,new_pr,2/5,data_integrity,"Greptile caught a real regression where the refactored delete_single method no longer deletes documents from the secondary index, which the old implementation handled by iterating through all indices in index_to_large_chunks_enabled.",2025-12-18 18:45:01
simstudioai/sim,https://github.com/simstudioai/sim/pull/2464,2464,improvement(hitl): show resume url in tag dropdown within hitl block,Pbonmars-20031006,2025-12-18 18:19:15,closed,new_pr,3/5,logic,"Greptile caught two implementation gaps in the human-in-the-loop self-reference feature: missing filtering logic that would expose unavailable fields to users (causing broken references and poor UX), and an incomplete update that missed one of three parallel code paths (causing the feature to work inconsistently across different scenarios).",2025-12-18 18:44:33
cyberdesk-hq/cyberdriver,https://github.com/cyberdesk-hq/cyberdriver/pull/31,31,"feat: v0.0.36, invisible execution, with cyberdriver logs",AlanDuong07,2025-12-18 16:58:58,closed,new_pr,3/5,logic,"This is a subtle but real escaping bug in VBScript string construction. The code applies Windows command-line escaping (`\""`) before VBScript string escaping (`""""`), resulting in malformed VBScript that would fail to properly launch processes with arguments containing quotes. This double-escaping interaction is non-obvious and would cause real failures in the invisible execution feature on Windows.",2025-12-18 18:44:33
pc-style/messenger-desktop,https://github.com/pcstyleorg/messenger-desktop/pull/6,6,"feat: add killer features (chameleon, invisible ink, chat heads, shortcuts)",pc-style,2025-12-18 17:23:38,closed,new_pr,4/5,security,"Greptile caught a critical security vulnerability where the chat head BrowserWindow is created with nodeIntegration enabled and contextIsolation disabled, which violates Electron security best practices and could allow malicious code execution.",2025-12-18 18:45:26
tinyrange/cc,https://github.com/tinyrange/cc/pull/23,23,Add basic network support,Vbitz,2025-12-18 20:53:10,closed,new_pr,1/5,"data_integrity, concurrency","Greptile caught multiple real concurrency bugs: race conditions causing panics when sending to closed channels during TCP listener/connection lifecycle, and a buffer pooling bug where frames are returned to the pool while the backend may still hold references, causing potential data corruption.",2025-12-18 22:11:29
simstudioai/sim,https://github.com/simstudioai/sim/pull/2475,2475,fix(sanitization): added more input sanitization to tool routes,waleedlatif1,2025-12-19 01:16:47,closed,new_pr,3/5,security,"Greptile identified that while the PR added input sanitization to tool routes, it missed validating the `messageId` parameter in Gmail label routes before interpolating it into URL paths. This creates a path traversal vulnerability where malicious messageIds containing sequences like '../' could manipulate API request paths, despite other parameters being properly validated.",2025-12-19 02:11:56
simstudioai/sim,https://github.com/simstudioai/sim/pull/2472,2472,"fix(authentication): added auth checks for various routes, mysql and postgres query validation, csp improvements",waleedlatif1,2025-12-19 00:35:35,closed,new_pr,4/5,security,"This identifies a real SQL injection vulnerability where user-controlled values in WHERE clauses are embedded as raw strings rather than parameterized, even though the PR claims to add query validation. While validateWhereClause may block some patterns, embedding raw strings in SQL is a genuine security risk that could allow injection through edge cases the validation doesn't cover.",2025-12-19 02:11:56
eventual-inc/daft,https://github.com/Eventual-Inc/Daft/pull/5857,5857,fix: Incorrect buffer pool calculation strategy when reading CSV,plotor,2025-12-19 00:11:47,closed,new_pr,2/5,logic,"Greptile caught an incomplete refactoring where chunk_size semantics were changed from bytes to rows in the local reader, but the remote reader path was not updated, creating inconsistent behavior between local and remote CSV reading.",2025-12-19 02:12:39
nvidia/dali,https://github.com/NVIDIA/DALI/pull/6143,6143,Enable arithmetic operations between device tensors/batches and scalars,rostan-t,2025-12-19 01:55:23,open,new_pr,5/5,"runtime, logic","Greptile caught two real bugs: a logic error in the two-pass device detection that breaks `scalar + gpu_tensor` operations, and a Python version compatibility issue with isinstance union syntax that would fail on Python 3.8/3.9.",2025-12-19 04:10:49
openreplay/openreplay,https://github.com/openreplay/openreplay/pull/4110,4110,SDK pipeline,zavorotynskiy,2025-12-19 01:27:24,closed,new_pr,2/5,data_integrity,"This is a real bug - the Delete function uses 'user_id' as the column name while all other queries in the file consistently use '""$user_id""' (with quotes and dollar sign). This inconsistency would cause the delete operation to fail or insert into the wrong column, breaking user deletion functionality. The bug is non-obvious as it's easy to miss the subtle naming difference across different functions.",2025-12-19 02:11:56
ever-works/ever-works-website-template,https://github.com/ever-works/ever-works-website-template/pull/417,417,fix(seed): use predefined admin credentials instead of auto-generated,ariefgp,2025-12-19 03:11:36,closed,new_pr,2/5,data_integrity,"Greptile caught a real data integrity issue where a migration updating related user and account tables lacks transaction atomicity, which could leave the database in an inconsistent state if one update succeeds and the other fails.",2025-12-19 04:10:54
openobserve/openobserve,https://github.com/openobserve/openobserve/pull/9694,9694,fix: add alert revamp v2,nikhilsaikethe,2025-12-19 05:24:50,closed,new_pr,3/5,security,"Greptile caught a real SQL injection vulnerability where user input is directly interpolated into LIKE clauses in SQL query generation without proper escaping, which could allow attackers to execute arbitrary SQL through alert condition values.",2025-12-19 06:11:53
ethyca/fides,https://github.com/ethyca/fides/pull/7167,7167,Add debounced input component,lucanovera,2025-12-19 06:14:36,closed,new_pr,1/5,logic,"Greptile caught a legitimate memory leak issue where debounced functions are recreated without cancelling previous ones, causing old timeouts to accumulate. This is a real bug that would affect production behavior.",2025-12-19 08:15:22
infisical/infisical,https://github.com/Infisical/infisical/pull/5077,5077,fix: show duplicate accounts with no org attached and fix duplicate invited accounts,carlosmonastyrski,2025-12-19 11:08:32,closed,new_pr,2/5,concurrency,"This is a legitimate race condition in security-critical signup code. Concurrent signup completions could bypass the duplicate cleanup since all requests would query before any deletions occur, potentially allowing multiple accepted accounts for the same email. The fix using FOR UPDATE locking is correct and actionable.",2025-12-19 12:15:29
simstudioai/sim,https://github.com/simstudioai/sim/pull/2478,2478,"fix(redaction): consolidate redaction utils, apply them to inputs and outputs before persisting logs",waleedlatif1,2025-12-19 12:52:03,closed,new_pr,2/5,logic,"Greptile caught a logic bug where the redaction code was incorrectly applying sensitive key pattern checks (like 'token', 'secret', 'auth') to string values instead of just object keys. This would cause legitimate user data containing these common words (like ""authentication token required"" or ""secret santa"") to be incorrectly redacted.",2025-12-19 14:14:00
bstewart2255/speddy,https://github.com/bstewart2255/speddy/pull/492,492,refactor: consolidate SessionDetailsModal and GroupDetailsModal into single component,bstewart2255,2025-12-19 13:33:19,closed,new_pr,3/5,logic,"This is a legitimate bug where ensureSessionsPersistence returns undefined in group mode when there are no sessions, but the calling code at lines 395, 440, and 594 uses the returned ID without checking for undefined. This would cause runtime errors or incorrect behavior when trying to perform curriculum/document operations with an undefined session ID.",2025-12-19 14:14:00
simstudioai/sim,https://github.com/simstudioai/sim/pull/2482,2482,"fix(autofill): add dummy inputs to prevent browser autofill for various fields, prevent having 0 workflows in workspace",waleedlatif1,2025-12-19 14:44:58,closed,new_pr,5/5,logic,"This is a valid catch of an incomplete feature implementation - the PR adds protection against deleting the last workflow via folder deletion, but the same protection is missing from the direct workflow deletion API, creating an inconsistent bypass. This is a real logic gap that would allow users to circumvent the intended business rule.",2025-12-19 16:19:39
browserbase/stagehand,https://github.com/browserbase/stagehand/pull/1449,1449,Add SEA binary build for packages/server,monadoid,2025-12-19 14:20:33,closed,new_pr,3/5,logic,"Greptile caught a package filter typo in the Windows CI workflow that builds the wrong package, which would cause the Windows SEA binary build to fail.",2025-12-19 16:20:37
ever-co/ever-gauzy,https://github.com/ever-co/ever-gauzy/pull/9275,9275,Stage,evereq,2025-12-19 14:16:40,closed,new_pr,0/5,runtime,"Greptile caught a critical runtime bug where the code calls `server.registerTool()` instead of the correct MCP SDK method `server.tool()`, which would cause all 324+ tools to fail at runtime since the method doesn't exist. This API mismatch would completely break the MCP server functionality and was hidden by `as any` type casting.",2025-12-19 16:19:39
emerge-lab/pufferdrive,https://github.com/Emerge-Lab/PufferDrive/pull/197,197,Fix bug in agent view for jerk dynamics model,daphne-cornelisse,2025-12-19 14:44:41,closed,new_pr,4/5,logic,"This identifies a real consistency bug where a hardcoded value '7' should be the constant 'PARTNER_FEATURES' to match a similar fix elsewhere in the same loop. If PARTNER_FEATURES changes from 7, this would cause incorrect indexing through partner observations, leading to data corruption or incorrect behavior. This is a non-obvious bug that requires understanding the context of a related fix.",2025-12-19 16:19:39
simstudioai/sim,https://github.com/simstudioai/sim/pull/2489,2489,"fix(subflow): prevent auto-connect across subflow edges with keyboard shortcut block additions, make positioning for auto-drop smarter",waleedlatif1,2025-12-19 17:45:29,closed,new_pr,4/5,logic,"This is a valid logic bug - the original code only prevents cross-container edges in one direction (insideâ†’root) by checking if closestBlockParentId exists but targetParentId doesn't. The fix correctly uses inequality comparison to catch both directions, preventing invalid workflow connections between different container scopes.",2025-12-19 18:40:21
simstudioai/sim,https://github.com/simstudioai/sim/pull/2487,2487,"fix(logs): always capture cost, logging size failures",icecrasher321,2025-12-19 17:15:01,closed,new_pr,3/5,logic,"This is a legitimate logic flaw in fallback/recovery code. The fallback handler `completeWithCostOnlyLog` processes the same `traceSpans` that may have caused the original failure, meaning the fallback itself could fail for the same reason. This defeats the purpose of having a fallback and could result in lost cost data. The fix is specific and actionable.",2025-12-19 18:40:21
emerge-lab/pufferdrive,https://github.com/Emerge-Lab/PufferDrive/pull/198,198,Collision checking fixes,mpragnay,2025-12-19 17:20:21,open,new_pr,2/5,runtime,"Greptile caught two real NULL pointer dereference bugs in C code: one where checkNeighbors returns NULL on invalid positions but the caller doesn't check before iterating, and another where calloc failure isn't handled before using the allocated memory.",2025-12-19 18:41:17
futuroptimist/sugarkube,https://github.com/futuroptimist/sugarkube/pull/2027,2027,Harden pi carrier stack rendering guardrails,futuroptimist,2025-12-19 20:15:37,closed,new_pr,1/5,runtime,"Greptile caught a real bug where the refactoring introduced `carrier_dims_resolved` but failed to update all references from `carrier_dims`, leaving undefined variable references that would cause runtime errors in OpenSCAD rendering.",2025-12-19 22:11:01
ever-works/ever-works-website-template,https://github.com/ever-works/ever-works-website-template/pull/419,419,fix(categories): remove duplicate pagination in categories page,Innocent-Akim,2025-12-20 03:06:55,closed,new_pr,2/5,logic,Greptile caught that removing the pagination component while leaving the pagination state/logic creates a broken standard pagination mode where users see paginated results but cannot navigate between pages.,2025-12-20 04:11:11
ever-works/ever-works-website-template,https://github.com/ever-works/ever-works-website-template/pull/418,418,feat(subscription): add subscription expiration management system,Innocent-Akim,2025-12-20 02:42:28,closed,new_pr,3/5,"logic, security","Greptile caught a critical bug where subscription creation ignores the requested plan type and always creates STANDARD plans, plus a security issue where the cron endpoint fails open without authentication when CRON_SECRET is not configured.",2025-12-20 04:11:19
ever-co/ever-gauzy,https://github.com/ever-co/ever-gauzy/pull/9281,9281,Stage,evereq,2025-12-20 10:43:23,closed,new_pr,1/5,logic,"Greptile identified a critical environment variable naming inconsistency in ARM64 build workflows, where `DESKTOP_AGENT_APP_*` prefixes are used instead of the expected `AGENT_APP_*` prefixes. This copy-paste error would cause the bump-version script to fail and break ARM64 CI/CD builds across multiple workflow files.",2025-12-20 12:08:33
simstudioai/sim,https://github.com/simstudioai/sim/pull/2500,2500,feat(audit): added audit log for billing line items,waleedlatif1,2025-12-20 13:30:52,closed,new_pr,5/5,data_integrity,Greptile caught a real cursor pagination bug where records with identical timestamps could be duplicated or skipped across pages due to inconsistent ordering.,2025-12-20 14:09:03
youversion/platform-sdk-react,https://github.com/youversion/platform-sdk-react/pull/86,86,feat(core): add pagination to getVersions endpoint,bmanquen,2025-12-20 12:03:44,closed,new_commits,4/5,logic,"Greptile caught a real validation bug where `safeParse` is called but its result is ignored, allowing invalid `page_size` values to be passed to the API without any error handling.",2025-12-20 14:09:21
simstudioai/sim,https://github.com/simstudioai/sim/pull/2504,2504,feat(settings): added snap to grid slider to settings,waleedlatif1,2025-12-20 16:38:25,closed,new_pr,4/5,data_integrity,"This catches a real validation mismatch where the backend schema allows values up to 100 but the UI only allows up to 50. This could allow API requests to bypass UI constraints and store invalid values, or cause validation failures for values that should be valid. The inconsistency between layers is a genuine bug that could cause unexpected behavior.",2025-12-20 18:46:17
futuroptimist/wove,https://github.com/futuroptimist/wove/pull/311,311,âœ¨ : Planner envelope warns on bounds,futuroptimist,2025-12-20 18:26:37,closed,new_pr,2/5,logic,"This is a real logic bug where the animation captures a stale opacity value at initialization time, but the code later dynamically changes the material opacity for warnings. The animation would use the old baseOpacity value instead of the updated warning opacity, causing the visual warning flash to be less intense than intended. The fix using a getter function is correct and actionable.",2025-12-20 18:46:17
simstudioai/sim,https://github.com/simstudioai/sim/pull/2507,2507,fix(notion): remove hyphenation of incoming page ID's,waleedlatif1,2025-12-20 19:03:24,closed,new_pr,5/5,logic,"This is a real bug where the PR removes UUID hyphenation formatting but the Notion blocks API still requires hyphenated UUIDs. The diff shows the formatting code was removed, but the pageId is still used directly in the blocks endpoint, which would cause API calls to fail. This is a non-obvious regression that could easily be missed.",2025-12-20 20:20:47
emerge-lab/pufferdrive,https://github.com/Emerge-Lab/PufferDrive/pull/201,201,Carla2d towns,mpragnay,2025-12-20 19:35:22,closed,new_pr,2/5,logic,"Greptile caught a critical velocity calculation bug where the code subtracts the current position from itself instead of using the previous position, resulting in zero velocity values in the generated trajectory data.",2025-12-20 20:21:45
onyx-dot-app/onyx,https://github.com/onyx-dot-app/onyx/pull/6934,6934,fix: sanitize postgres to remove nul characters,rohoswagger,2025-12-20 21:33:49,closed,new_pr,2/5,data_integrity,"Greptile identified that the PR only partially fixes the NUL character issue - two other functions (`create_search_doc_from_inference_section` and `update_search_docs_table_with_relevance`) write to the same database table without applying the new sanitization, leaving the vulnerability open through alternative code paths.",2025-12-20 22:10:00
eventual-inc/daft,https://github.com/Eventual-Inc/Daft/pull/5864,5864,fix(iceberg): disable count pushdown when delete files are present,huleilei,2025-12-21 01:00:18,closed,new_pr,5/5,"logic, runtime","Greptile caught two real bugs: using the wrong Iceberg metadata field (`deleted-data-files` instead of `total-delete-files`) which would fail to detect delete files, and a type error where string values from the summary would be incorrectly compared as integers.",2025-12-21 04:13:18
gptme/gptme,https://github.com/gptme/gptme/pull/985,985,feat: add parallel tool execution support,TimeToBuildBob,2025-12-21 00:17:46,closed,new_pr,3/5,logic,Greptile caught a missing f-string prefix in terminal_state_title() that would display literal placeholder text instead of interpolating the tool name. The other comments about KeyboardInterrupt handling and race conditions are valid design concerns but are theoretical issues rather than concrete bugs.,2025-12-21 04:13:24
huskit/website-agent,https://github.com/HuskIT/website-agent/pull/18,18, Implement user project tables with cross-device persistence,khoitran13791,2025-12-21 03:17:41,closed,new_pr,3/5,"logic, security","Greptile identified security vulnerabilities in the snapshot API endpoints where project ownership is not validated before access, and caught a silent failure mode in RLS context setup that could lead to authorization bypasses. Also found a logic error in URL slug generation.",2025-12-21 04:13:35
