repo,pr_url,pr_number,pr_title,pr_author,pr_created_at,pr_state,trigger_type,pr_score,catch_categories,summary,evaluated_at
mellanox/hw-mgmt,https://github.com/Mellanox/hw-mgmt/pull/2221,2221,hw-mgmt: tools: Amend Cartridge EEPROM Flash Tool,vadimp-nvidia,2026-01-04 07:29:17,closed,new_pr,4/5,logic,"Greptile caught a real variable scoping bug where undefined local variables from another function are used in a device-ready wait loop, causing the loop to exit immediately rather than properly waiting for the device.",2026-01-04 08:12:31
eventual-inc/daft,https://github.com/Eventual-Inc/Daft/pull/5913,5913,"feat(schema): expand Arrow type support for date, time, binary, and list variants",xushiyan,2026-01-04 19:35:45,closed,new_pr,2/5,data_integrity,"Greptile caught a real inconsistency in Arrow type conversion where Date64 is mapped differently in two separate conversion implementations, which could cause data type mismatches depending on the code path taken.",2026-01-04 20:35:09
emerge-lab/pufferdrive,https://github.com/Emerge-Lab/PufferDrive/pull/246,246,Fix/visualizer inherit config,eugenevinitsky,2026-01-04 21:35:15,open,new_pr,3/5,logic,"Greptile caught a silent failure bug where cfg.read() would not raise an error if the base INI file is missing, resulting in an empty config being written and potentially causing the visualizer to behave unexpectedly.",2026-01-04 22:17:09
raycast/extensions,https://github.com/raycast/extensions/pull/24183,24183,Add simpler-timer extension,LugeKit,2026-01-05 01:31:35,open,new_pr,1/5,security,"Greptile correctly identified a command injection vulnerability where user-provided content is insufficiently sanitized before being passed to shell execution, allowing arbitrary command execution through various shell escape mechanisms.",2026-01-05 02:17:52
cedarjs/cedar,https://github.com/cedarjs/cedar/pull/939,939,fix(ui): Fix import issues in Mantine UI setup,Tobbe,2026-01-05 01:05:06,closed,new_pr,0/5,runtime,"Greptile identified two critical import bugs that would cause runtime failures: a case-sensitive typo in the lodash import path ('forown.js' instead of 'forOwn.js') that would break on Linux/CI systems, and an incorrect named import from @babel/generator which only exports a default, causing undefined imports and crashes.",2026-01-05 02:12:44
tinyrange/cc,https://github.com/tinyrange/cc/pull/47,47,Feature/timeslice,Vbitz,2026-01-04 05:15:24,closed,new_commits,4/5,logic,"Greptile identified a critical bug where the timeslice feature is completely non-functional - while a timing data file writer is created, it's never actually connected to the recording components, so all timing data is lost and output files remain empty. The recorders are created in goroutines but never linked to the file writer, making the feature appear to work while silently failing to capture any data.",2026-01-05 02:12:44
ever-co/ever-gauzy,https://github.com/ever-co/ever-gauzy/pull/9311,9311,[Fix] AI suggestions #9298,adkif,2026-01-05 03:21:06,closed,new_pr,2/5,security,"Greptile caught a real security vulnerability in path traversal protection code where normalizing backslashes to forward slashes before calling `path.isAbsolute()` on Windows would cause the function to miss Unix-style absolute paths, undermining the security validation this PR was intended to provide.",2026-01-05 04:18:06
raycast/extensions,https://github.com/raycast/extensions/pull/24196,24196,Fix memory issues: implement streaming file processing,borzov,2026-01-05 07:38:29,closed,new_pr,3/5,logic,"The second comment identifies a real bug: JavaScript's `.replace()` with a string argument only replaces the first occurrence. If the intent is to insert content before the closing `</metadata>` tag but the code replaces the first newline (right after `<metadata>`), the content will be inserted in the wrong location. This is a non-obvious JavaScript gotcha that affects actual functionality.",2026-01-05 08:13:22
mellanox/libxlio,https://github.com/Mellanox/libxlio/pull/541,541,issue: 4807454 Using DPCP for max SQ WQEBBs,AlexanderGrissik,2026-01-05 07:28:14,closed,new_pr,2/5,runtime,"Greptile caught a real uninitialized variable bug where `m_max_sq_wqebbs` is not set to a default value when the DPCP capabilities fetch fails, leading to undefined behavior on the error path.",2026-01-05 08:18:40
browserbase/stagehand,https://github.com/browserbase/stagehand/pull/1496,1496,fix: handle page close events and avoid errors on closed targets,shrey150,2026-01-05 11:59:23,closed,new_pr,2/5,"logic, concurrency","Greptile caught a race condition bug where the code could attempt to set an already-closing page as the active page during browser automation. This timing issue occurs because when a page close event fires, the page may still appear in the context.pages() array but is actually in the process of closing, which would cause errors or undefined behavior when trying to activate it.",2026-01-05 12:14:38
remnawave/panel,https://github.com/remnawave/panel/pull/299,299,Add ClashMac client,Davoyan,2026-01-05 12:30:54,closed,new_pr,2/5,logic,Greptile caught a configuration bug where the ClashMac client is declared as a macOS platform but incorrectly provides an Android download link instead of a macOS one. This would cause macOS users to download the wrong client file for their platform.,2026-01-05 14:11:44
browseros-ai/browseros-server,https://github.com/browseros-ai/BrowserOS-agent/pull/162,162,feat: gating to use MCP port instead of Agent port with new unified server,shadowfax92,2026-01-05 13:13:18,closed,new_pr,3/5,concurrency,"This identifies a real race condition where `Capabilities.supports()` could throw an error if called before `Capabilities.initialize()` completes, since initialization runs without `await` in the background. The fix is specific and actionable - checking `isInitialized()` first provides a safe default. This is non-obvious as it requires understanding the async initialization flow across multiple files.",2026-01-05 14:11:44
workos/workos-php,https://github.com/workos/workos-php/pull/315,315,Implement Authkit Sessions,birdcar,2026-01-05 13:33:04,open,new_pr,5/5,runtime,"Greptile caught a critical runtime bug where the refresh() method calls authenticateWithRefreshToken() with incorrect parameters - missing the required clientId parameter that should be first, which would cause the session refresh functionality to fail completely at runtime.",2026-01-05 14:15:38
nvidia/fuser,https://github.com/NVIDIA/Fuser/pull/5737,5737,Benchmark for nvfp4 scaled mm,protonu,2025-12-23 13:19:35,open,new_commits,3/5,logic,"Greptile caught a dtype inconsistency where the fake registration function returns a tensor with activation.dtype while the actual custom op hardcodes torch.bfloat16, which could cause issues during graph tracing/compilation.",2026-01-05 16:27:05
deltahacks/portal,https://github.com/deltahacks/portal/pull/411,411,feat: enable apple wallet pass creation,Krish120003,2026-01-05 14:50:30,closed,new_pr,3/5,security,"A hardcoded authentication token in a pass.json file that will be distributed to users is a real security vulnerability - all passes would share the same auth token, allowing anyone with one pass to potentially access or manipulate other users' passes through the webServiceURL API. This is a non-obvious catch since it's in a configuration file that might be overlooked during review.",2026-01-05 16:21:33
browseros-ai/browseros-server,https://github.com/browseros-ai/BrowserOS-agent/pull/164,164,fix: build script + posthog,shadowfax92,2026-01-05 16:57:27,closed,new_pr,1/5,logic,"Greptile caught a critical build configuration bug where the PR added POSTHOG_ENDPOINT as a required production environment variable in the build script, but simultaneously removed its usage from the actual codebase. This inconsistency would cause all production builds to fail validation when checking for the now-unused but still-required variable.",2026-01-05 18:46:48
deltahacks/portal,https://github.com/deltahacks/portal/pull/416,416,feat: make events unique+ handle url ids,arian81,2026-01-05 19:53:21,closed,new_pr,3/5,performance,"This is a legitimate logic bug - the removal of the conditional check means the timeout now runs continuously in an infinite loop when status is 'idle', since setting state to 'idle' triggers the effect again, which sets another timeout. This creates unnecessary re-renders and could impact performance. The bug is non-obvious because the infinite loop behavior isn't immediately apparent from reading the code.",2026-01-05 20:23:18
synth-laboratories/synth-ai,https://github.com/synth-laboratories/synth-ai/pull/154,154,cleaned up ui on header and footer ribbons,mikezangus,2026-01-05 19:19:20,closed,new_pr,4/5,logic,Greptile identified a stale closure bug where the `snapshot` variable is captured once at module initialization but never updates to reflect current user/org values. This causes the profile modal to display outdated information after login or other state changes until the app is restarted.,2026-01-05 20:23:18
joby-aviation/noodles.gl,https://github.com/joby-aviation/noodles.gl/pull/210,210,Add text and binary format options to FileOp,akre54,2026-01-05 22:11:29,closed,new_pr,3/5,data_integrity,"Greptile caught a data corruption bug where binary files (like images and compressed data) loaded from project assets get corrupted because the code reads them as text and then re-encodes them via TextEncoder, which destroys non-UTF-8 byte sequences. This is a subtle issue that silently corrupts binary data during the text-to-binary conversion process.",2026-01-06 00:12:40
openreplay/openreplay,https://github.com/openreplay/openreplay/pull/4154,4154,dev,tahayk,2026-01-06 06:16:11,closed,new_pr,4/5,data_integrity,The second comment identifies a real type mismatch bug - user_id being String in one table but UInt16 in another would cause JOIN failures or incorrect results in ClickHouse. This is a non-obvious schema inconsistency that would cause data integrity issues in production queries.,2026-01-06 08:12:09
openreplay/openreplay,https://github.com/openreplay/openreplay/pull/4158,4158,dev,tahayk,2026-01-06 09:33:39,closed,new_pr,2/5,data_integrity,Comment #2 identifies a real data type mismatch bug where user_id is String in the users table but UInt16 in the events table. This would cause query failures and break referential integrity between tables - a non-obvious issue that requires cross-referencing multiple table definitions to catch. Comments #1 and #3 about duplicate ORDER BY clauses are also valid syntax errors that would prevent schema creation.,2026-01-06 10:13:59
joby-aviation/noodles.gl,https://github.com/joby-aviation/noodles.gl/pull/211,211,feat: Add external AI control for automated pipeline creation,akre54,2026-01-06 08:40:00,closed,new_pr,2/5,runtime,"Greptile caught a real runtime bug where MCPTools class is instantiated without its required ContextLoader constructor parameter in both tool-adapter.ts and worker-bridge.ts, which would crash the external control system on initialization.",2026-01-06 10:19:47
run-ai/runai-model-streamer,https://github.com/run-ai/runai-model-streamer/pull/118,118,list_safetensors to be non recursive and support ignore pattern,noa-neria,2026-01-06 10:32:23,open,new_pr,0/5,"logic, runtime","Greptile caught a logic bug where ignore pattern matching uses basename instead of relative path, breaking subdirectory filtering, and identified missing parameter forwarding in the mock shim that would cause runtime errors.",2026-01-06 12:19:59
simstudioai/sim,https://github.com/simstudioai/sim/pull/2689,2689,feat(supabase): added ability so select certain rows in supabase tools,waleedlatif1,2026-01-06 12:09:52,closed,new_pr,5/5,logic,"Greptile identified a URL encoding bug in the Supabase tools feature where special characters (like parentheses and commas) in PostgREST select queries aren't being properly encoded, which will cause API requests to fail when using embedded resources or special column names. The tool points to existing code in the codebase that already handles this encoding correctly.",2026-01-06 14:13:15
deltahacks/portal,https://github.com/deltahacks/portal/pull/417,417,fix: check for user being accepted,arian81,2026-01-06 13:29:54,closed,new_pr,3/5,security,"Greptile caught an inconsistent security validation where RSVP status is checked for Apple Wallet passes but not Google Wallet passes, allowing non-accepted users to bypass the restriction by using Google Wallet instead.",2026-01-06 14:18:31
synth-laboratories/synth-ai,https://github.com/synth-laboratories/synth-ai/pull/157,157,Feat/tui create job,mikezangus,2026-01-06 12:30:43,closed,new_pr,3/5,security,This is a legitimate security vulnerability - API keys stored in plaintext files with default permissions (typically 644) can be read by any user on a multi-user system. The fix is specific and actionable: add `{ mode: 0o600 }` to restrict to owner-only access. This is a non-obvious issue that human reviewers often miss.,2026-01-06 14:13:15
onyx-dot-app/onyx,https://github.com/onyx-dot-app/onyx/pull/7237,7237,fix(users): Multi-tenant signup,justin-tahara,2026-01-06 15:39:38,closed,new_pr,4/5,runtime,"Greptile caught a sync/async session mismatch where a synchronous database function is being passed an async session, which would cause a runtime error during multi-tenant user signup.",2026-01-06 16:25:12
simstudioai/sim,https://github.com/simstudioai/sim/pull/2697,2697,feat(combobox): added expression support to combobox,waleedlatif1,2026-01-06 15:00:48,closed,new_pr,4/5,logic,"This is a real infinite loop bug - when fetchOptions fails, the conditions (fetchedOptions.length === 0 && !isLoadingOptions) remain true, causing the useEffect to continuously retry the failed fetch. This would hammer the server and potentially freeze the UI. The fix correctly adds a fetchError check to break the loop.",2026-01-06 16:21:13
browserbase/stagehand,https://github.com/browserbase/stagehand/pull/1509,1509,[feat]: add support for `page.waitForSelector()`,seanmcguire12,2026-01-06 16:01:19,open,new_pr,4/5,concurrency,"Greptile caught a real race condition in the waitForSelector Promise implementation where timeout and success callbacks could both execute, leading to calling both resolve() and reject() on the same Promise.",2026-01-06 18:53:46
tinyrange/cc,https://github.com/tinyrange/cc/pull/51,51,refactor: add explicit UI widget framework for ccapp graphics,Vbitz,2026-01-06 15:39:26,closed,new_pr,4/5,logic,"This is a real logic bug where keyboard events (KeyEvent, TextEvent) will never reach child content because getMousePos returns (0,0) for non-mouse events, causing the bounds.Contains check to fail. This would silently break keyboard input in scrollable content areas - a non-obvious issue that requires understanding the event dispatch flow.",2026-01-06 16:21:13
onyx-dot-app/onyx,https://github.com/onyx-dot-app/onyx/pull/7245,7245,fix(files): propagate file error from backend,Danelegend,2026-01-06 17:13:03,closed,new_pr,5/5,runtime,"Greptile identified a genuine runtime bug where a list was being called as a function instead of using .append(), which would crash the file categorization feature.",2026-01-06 18:53:29
onyx-dot-app/onyx,https://github.com/onyx-dot-app/onyx/pull/7248,7248,fix(web search): removing site: operator from exa query,jessicasingh7,2026-01-06 18:21:00,open,new_pr,5/5,logic,"Greptile caught a real regex inconsistency bug where the extraction and removal patterns for site: operators don't match, causing queries with a space after 'site:' to be incorrectly processed.",2026-01-06 18:53:35
bluedotimpact/bluedot,https://github.com/bluedotimpact/bluedot/pull/1910,1910,[bug] Prevent independent learners in cohort-courses from requesting certificates,marn-in-prod,2026-01-06 17:09:48,closed,new_pr,4/5,logic,Greptile identified dead/unreachable code after a refactor - the code block at lines 413-425 can never execute because all paths that would reach it now return early. This is a non-obvious logic issue that indicates incomplete refactoring and could mislead future developers or hide bugs.,2026-01-06 18:49:19
stack-auth/stack-auth,https://github.com/stack-auth/stack-auth/pull/1087,1087,upgrade/downgrade plans,BilalG1,2026-01-06 17:50:32,open,new_pr,3/5,data_integrity,Greptile caught a real data integrity bug where the code stores stale billing period dates from the old subscription item instead of the updated subscription's current period dates after a plan switch.,2026-01-06 18:53:52
bstewart2255/speddy,https://github.com/bstewart2255/speddy/pull/543,543,"feat: CARE Dashboard - Status options, Initial stage, and Assessment tracking",bstewart2255,2026-01-06 16:27:28,closed,new_pr,4/5,data_integrity,"This migration permanently deletes all existing disposition data by setting it to NULL before adding a new constraint, causing irreversible data loss. This is a real bug that could easily be missed since migrations often seem routine, but running this would destroy production case status history.",2026-01-06 18:49:19
ironyh/vuesip,https://github.com/ironyh/VueSIP/pull/108,108,feat(composables): add useConnectionRecovery for ICE restart handling,ironyh,2026-01-06 17:18:05,closed,new_pr,2/5,logic,"Greptile identified a critical WebRTC implementation bug where the ICE restart feature creates a local offer but fails to exchange it with the remote peer through signaling. This makes the entire connection recovery feature silently non-functional, as WebRTC requires completing the full offer/answer exchange for ICE restart to work.",2026-01-06 18:49:19
onyx-dot-app/onyx,https://github.com/onyx-dot-app/onyx/pull/7250,7250,fix(chat): Add Content-Disposition header to chat file downloads,bdatdo0601,2026-01-06 18:49:57,open,new_pr,3/5,security,"Greptile caught a real HTTP header injection vulnerability where unsanitized user-controlled filenames are directly interpolated into the Content-Disposition header, which could allow response splitting attacks.",2026-01-06 20:28:38
deltahacks/portal,https://github.com/deltahacks/portal/pull/418,418,feat: properly handle different statues for scanning endpoint,arian81,2026-01-06 21:36:10,closed,new_pr,0/5,logic,"Greptile caught a critical JavaScript bug where the `in` operator was incorrectly used to check array membership instead of `.includes()`. This would cause the authorization check to always fail silently, potentially allowing unauthorized users to check in to the event.",2026-01-06 22:16:26
helicone/helicone,https://github.com/Helicone/helicone/pull/5473,5473,attempt executor retry for helcione provider and 502 errors,chitalian,2026-01-06 22:33:18,open,new_pr,1/5,data_integrity,"Greptile caught a real data integrity bug where retry logic would cause the same escrow to be finalized multiple times with different costs, potentially corrupting wallet balances in a pay-as-you-go billing system.",2026-01-07 00:17:31
openobserve/openobserve,https://github.com/openobserve/openobserve/pull/9871,9871,fix: sync distinct stream retention to original stream,YashodhanJoshi1,2026-01-06 23:33:15,closed,new_pr,2/5,logic,"Greptile caught a real logic bug where the migration code uses the wrong stream name (`stream_name` instead of `distinct_stream`) when building the super cluster sync key, which would cause incorrect stream metadata updates in enterprise distributed deployments.",2026-01-07 00:17:37
atuinsh/desktop,https://github.com/atuinsh/desktop/pull/325,325,feat: add SSH connection settings modal with identity key configuration,ellie,2026-01-06 21:25:50,closed,new_commits,3/5,security,"This is a real shell injection/escaping vulnerability in SSH command execution. Incomplete shell escaping that doesn't handle newlines, tabs, or backslashes could allow command injection or cause unexpected behavior when executing remote commands. This is a subtle security issue in production code that could be easily missed.",2026-01-07 00:13:06
openobserve/openobserve,https://github.com/openobserve/openobserve/pull/9873,9873,feat: add js for claim parser,oasisk,2026-01-07 00:37:14,closed,new_pr,3/5,logic,"Greptile caught a real localization bug where the Chinese translation for 'auto' was incorrectly changed to 'æ±½è½¦' (car/automobile) instead of 'è‡ªåŠ¨' (automatic), which would display wrong text to Chinese users.",2026-01-07 02:15:39
raycast/extensions,https://github.com/raycast/extensions/pull/24257,24257,[toggl-track] Use cache to avoid hitting API limits,lukebars,2026-01-07 02:56:02,open,new_pr,2/5,data_integrity,"Greptile correctly identified that the caching implementation uses a static cache key while the function accepts dynamic date range parameters, which would cause different queries to return stale/incorrect cached results.",2026-01-07 04:18:00
openobserve/openobserve,https://github.com/openobserve/openobserve/pull/9884,9884,feat: Create Alert from dashboard setup - alert name with spacing issue. (Backend),mmosarafO2,2026-01-07 05:03:29,closed,new_pr,3/5,logic,"Greptile caught an incomplete fix where the PR only replaces spaces in alert names but the validation regex also forbids other special characters (:#?&%'""). Panel titles containing these characters would still fail validation.",2026-01-07 06:17:21
openobserve/openobserve,https://github.com/openobserve/openobserve/pull/9879,9879,chore: improve tab navigation UX and FQN priority selector,ByteBaker,2026-01-07 04:14:28,closed,new_pr,3/5,logic,"Greptile caught a real logic bug where search filtering causes incorrect array index usage - when users filter the priority list and then try to reorder or delete items, the wrong items would be affected because the code uses indexOf on the full array instead of the filtered index.",2026-01-07 06:17:27
isaac-sim/isaaclab,https://github.com/isaac-sim/IsaacLab/pull/4348,4348,Add check to avoid creating transforms for non-xformable prims,Mayankm96,2026-01-07 04:56:37,closed,new_pr,2/5,logic,"This is a genuine logic error where the code incorrectly treats USD Scope prims as non-Xformable when they actually inherit from UsdGeom.Xformable. This would prevent users from applying transforms to Scope prims when they legitimately should be able to, causing incorrect behavior in a USD-based simulation framework.",2026-01-07 06:12:37
openobserve/openobserve,https://github.com/openobserve/openobserve/pull/9888,9888,fix: add metrics query retention configuration option,hengfeiyang,2026-01-07 06:34:45,closed,new_pr,2/5,logic,"Greptile correctly identified that a config option named 'metrics_query_retention' is being applied to ALL stream types (logs, traces, metrics) when it should only apply to metrics streams. This is a real logic bug that would incorrectly change retention behavior for non-metrics data, and the fix is clear and actionable.",2026-01-07 08:15:27
openobserve/openobserve,https://github.com/openobserve/openobserve/pull/9887,9887,fix: add metrics query retention configuration option,hengfeiyang,2026-01-07 06:28:44,closed,new_pr,1/5,logic,"Greptile caught a real logic bug where a metrics-specific retention setting was incorrectly being applied to all stream types, which would cause incorrect query behavior for logs and traces data.",2026-01-07 08:21:19
nvidia/cloudai,https://github.com/NVIDIA/cloudai/pull/769,769,Provide CMS-friendly documentation build,amaslenn,2026-01-06 03:20:21,closed,new_commits,5/5,logic,"Greptile caught a real path resolution bug where `Path.cwd()` would incorrectly resolve mermaid CLI and puppeteer config paths when sphinx-build is invoked from the repository root, causing the CMS documentation build to fail.",2026-01-07 08:21:36
eventual-inc/daft,https://github.com/Eventual-Inc/Daft/pull/5968,5968,perf: dont eval empty recordbatches,universalmind303,2026-01-07 08:53:32,open,new_pr,4/5,logic,"Greptile caught a logic bug where the performance optimization to skip evaluation on empty record batches would incorrectly return empty results for aggregation expressions like COUNT(*), which should return a single row with value 0 on empty tables.",2026-01-07 10:21:30
openreplay/openreplay,https://github.com/openreplay/openreplay/pull/4167,4167,refactor(chalice): lexicon return events count and properties count,tahayk,2026-01-07 09:26:34,closed,new_pr,2/5,logic,"Greptile caught a SQL logic bug where filtering on LEFT JOIN columns in the WHERE clause instead of the ON clause was effectively converting the LEFT JOIN to an INNER JOIN. This would cause valid events/properties without autocomplete data to be silently dropped from API responses, resulting in potential data loss.",2026-01-07 10:16:18
ethyca/fides,https://github.com/ethyca/fides/pull/7192,7192,Update DSR notification UX,jack-gale-ethyca,2026-01-07 11:18:36,open,new_pr,3/5,logic,"Greptile caught a real functional regression where the ConfigureAlerts drawer no longer loads existing notification settings from the API, preventing users from viewing or editing their current configuration.",2026-01-07 12:24:36
stack-auth/stack-auth,https://github.com/stack-auth/stack-auth/pull/1088,1088,Paginated list tests,N2D4,2026-01-07 12:21:55,closed,new_pr,2/5,logic,"Greptile identified a pagination logic bug where cursors are being assigned based on the original array positions before sorting, but users receive the sorted results. This causes incorrect pagination when users try to navigate through sorted data, as the cursor positions no longer correspond to the actual sorted order of items.",2026-01-07 14:17:36
